{"artifacts":[{"architecture":"x86_64","bytes":"304661","edition":"full","evidence":{"scope":"linux-packages","sha256":"7ea5e6b74d66f1fa3ace05184a4b73831a44d77a9d2cbe16747f98393169ba72"},"forArtifact":"local-media-gallery-0.1.0-full-x86_64-linux-candidate.deb","format":"json","inventory":{"bytes":"304661","files":1,"sha256":"5a410cb3079d664c676b8e404a529c85d4ccc94e0449a16f78535435f5f4e434"},"name":"full-prior.update.json","optionalTools":[],"platform":"linux","prerequisites":[],"role":"update-descriptor","sha256":"5a410cb3079d664c676b8e404a529c85d4ccc94e0449a16f78535435f5f4e434","url":"https://github.com/shruggietech/local-media-gallery/releases/download/v0.1.0/full-prior.update.json"},{"architecture":"aarch64","bytes":"9420868","edition":"full","evidence":{"scope":"macos-packages","sha256":"c3100aa789c2acb3c7734df54d1fece58a9cf8593cef72290221bdc836909f35"},"format":"dmg","inventory":{"bytes":"19398346","files":1194,"sha256":"c58e0df3d4b36084cec93b1d4820c06d437a2b96d9057d5dc2b46884e2652a20"},"name":"local-media-gallery-0.1.0-full-aarch64-macos-candidate.dmg","optionalTools":["Optional video thumbnails: separately selected FFmpeg"],"platform":"macos","prerequisites":["macOS 15 Apple Silicon; OS WKWebView"],"role":"package","sha256":"407e5a4ce78a4d06fdae122d5576e06633e2b2c9767d17f862f27599d8eb7f98","url":"https://github.com/shruggietech/local-media-gallery/releases/download/v0.1.0/local-media-gallery-0.1.0-full-aarch64-macos-candidate.dmg"},{"architecture":"x86_64","bytes":"4976488","edition":"full","evidence":{"scope":"linux-packages","sha256":"7ea5e6b74d66f1fa3ace05184a4b73831a44d77a9d2cbe16747f98393169ba72"},"format":"deb","inventory":{"bytes":"20487989","files":1266,"sha256":"5e04acc92b50ebf19780cd28e911ce1f45328c08fe45d8b94c455dcc8eb65a7d"},"name":"local-media-gallery-0.1.0-full-x86_64-linux-candidate.deb","optionalTools":["Optional video thumbnails: separately selected FFmpeg"],"platform":"linux","prerequisites":["libc6 (>= 2.39), libcairo2 (>= 1.10.0), libdbus-1-3 (>= 1.9.14), libgcc-s1 (>= 4.2), libgdk-pixbuf-2.0-0 (>= 2.36.9), libglib2.0-0t64 (>= 2.66.0), libgtk-3-0t64 (>= 3.21.5), libjavascriptcoregtk-4.1-0, libsoup-3.0-0 (>= 3.0.3), libwebkit2gtk-4.1-0 (>= 2.41.90), gstreamer1.0-libav, gstreamer1.0-plugins-good, gstreamer1.0-plugins-bad, gstreamer1.0-plugins-ugly"],"role":"package","sha256":"33b34b80ccfb30d68abb261b644196fc5455654804ebe5bda32999f0482a29e3","url":"https://github.com/shruggietech/local-media-gallery/releases/download/v0.1.0/local-media-gallery-0.1.0-full-x86_64-linux-candidate.deb"},{"architecture":"x86_64","bytes":"16963807","edition":"full","evidence":{"scope":"windows-packages","sha256":"f36bf55f9fd610ac08e2e7627610433a8ecca72bee8e8a77daae0efbcd1358bd"},"format":"zip","inventory":{"bytes":"29381984","files":12,"sha256":"3a6e0dc090489adcacc3aff1dbf29dd2d46429ffbed4c4ce523654bbaecb53d1"},"name":"local-media-gallery-0.1.0-full-x86_64-windows-candidate.zip","optionalTools":["Optional video thumbnails: separately selected FFmpeg"],"platform":"windows","prerequisites":["Windows 10 22H2/11 x64; Microsoft Edge WebView2 Evergreen Runtime"],"role":"package","sha256":"7878f6eeb587e43baac3183683bfd259273a55fe65c4bc3b1745a3f3b697779e","url":"https://github.com/shruggietech/local-media-gallery/releases/download/v0.1.0/local-media-gallery-0.1.0-full-x86_64-windows-candidate.zip"},{"architecture":"aarch64","bytes":"8671978","edition":"lite","evidence":{"scope":"macos-packages","sha256":"c3100aa789c2acb3c7734df54d1fece58a9cf8593cef72290221bdc836909f35"},"format":"zip","inventory":{"bytes":"19398335","files":1194,"sha256":"7d503604ea42f62bc7bf89cb394924a281cfa333e7a9cdd132b51c0021912afa"},"name":"local-media-gallery-0.1.0-lite-aarch64-macos-candidate.zip","optionalTools":["Optional video thumbnails: separately selected FFmpeg"],"platform":"macos","prerequisites":["macOS 15 Apple Silicon; OS WKWebView"],"role":"package","sha256":"404ec778ff58278a6dc54131b801f0408a78e5e838d6b1bff75496a6df380a39","url":"https://github.com/shruggietech/local-media-gallery/releases/download/v0.1.0/local-media-gallery-0.1.0-lite-aarch64-macos-candidate.zip"},{"architecture":"x86_64","bytes":"6842356","edition":"lite","evidence":{"scope":"linux-packages","sha256":"7ea5e6b74d66f1fa3ace05184a4b73831a44d77a9d2cbe16747f98393169ba72"},"format":"tar.gz","inventory":{"bytes":"20691703","files":1262,"sha256":"26aaa06d07d3983071942f09d71e18ce21445e142880153d60777146c8e2efc9"},"name":"local-media-gallery-0.1.0-lite-x86_64-linux-candidate.tar.gz","optionalTools":["Optional video thumbnails: separately selected FFmpeg"],"platform":"linux","prerequisites":["libc6 (>= 2.39), libcairo2 (>= 1.10.0), libdbus-1-3 (>= 1.9.14), libgcc-s1 (>= 4.2), libgdk-pixbuf-2.0-0 (>= 2.36.9), libglib2.0-0t64 (>= 2.66.0), libgtk-3-0t64 (>= 3.21.5), libjavascriptcoregtk-4.1-0, libsoup-3.0-0 (>= 3.0.3), libwebkit2gtk-4.1-0 (>= 2.41.90), gstreamer1.0-libav, gstreamer1.0-plugins-good, gstreamer1.0-plugins-bad, gstreamer1.0-plugins-ugly"],"role":"package","sha256":"87fe7c321d8b02b2ee3c6ad7dfb998d54ea3b1b0de8ae80872f79f1d64637141","url":"https://github.com/shruggietech/local-media-gallery/releases/download/v0.1.0/local-media-gallery-0.1.0-lite-x86_64-linux-candidate.tar.gz"},{"architecture":"x86_64","bytes":"8737014","edition":"lite","evidence":{"scope":"windows-packages","sha256":"f36bf55f9fd610ac08e2e7627610433a8ecca72bee8e8a77daae0efbcd1358bd"},"format":"zip","inventory":{"bytes":"23112386","files":1213,"sha256":"92461cc2ed67f5534442b812cc68ed968d7b17946f71da3740fd5ac91becf4e6"},"name":"local-media-gallery-0.1.0-lite-x86_64-windows-candidate.zip","optionalTools":["Optional video thumbnails: separately selected FFmpeg"],"platform":"windows","prerequisites":["Windows 10 22H2/11 x64; Microsoft Edge WebView2 Evergreen Runtime"],"role":"package","sha256":"b08de05fb82502ed494cd8f64bd5f33c7f2a081f5220df013853a609aa1e0a5d","url":"https://github.com/shruggietech/local-media-gallery/releases/download/v0.1.0/local-media-gallery-0.1.0-lite-x86_64-windows-candidate.zip"}],"candidateId":"3cf8faac1d89fb83d394db9d73c46a6d02597c6b22ca2f9e3626819155599b87","documentation":{"retainedSha256":"386afca10c3575d755c1fce244aa22c8014e2b16f47410c7933a5fcb46ebaa3f","reviewSha256":"42d1313efa6a9fd2967f25320fc18f7419c9b6dc5f2b67bfad36299e1b58c769","schemaSha256":"1bd31e9371d5e9de5d1b848f0999dfc6a7eb8ad2e79a49e9d8bd716fe2672571","snapshotSha256":"cde73a5066d0f37a3bde8d3c5c7ae68edbc7c9c2cdedaf717e457bc7639f34eb","version":"v0.1.0"},"formatVersion":1,"gates":{"after":{"candidateId":"3cf8faac1d89fb83d394db9d73c46a6d02597c6b22ca2f9e3626819155599b87","checkedAt":"2026-11-01T04:48:09.431Z","checks":[{"name":"rendering","result":"pass"},{"name":"navigation","result":"pass"},{"name":"links-assets","result":"pass"},{"name":"version-selection","result":"pass"},{"name":"search","result":"pass"},{"name":"schemas-examples","result":"pass"},{"name":"review","result":"pass"}],"phase":"publication","projectionSha256":"326ef5ab24775321b619ca0309e9b1e23c03569e6568cee67d29ebc0f64ee0d8","publicationSha256":"e40019efbc40435a1919b06497a932f876c227b4ef2182fff7d8197b0c285670","rendererSha256":"3a1d841c758b2111519ff8ca9d2f040f3c671a9431a0e417f6733098f9434a58","result":"pass","snapshotsSha256":"386afca10c3575d755c1fce244aa22c8014e2b16f47410c7933a5fcb46ebaa3f","sourceRevision":"f4eb6b5530daa4030a2e439f689838c8367a42c8","sourceSha256":"3a1d841c758b2111519ff8ca9d2f040f3c671a9431a0e417f6733098f9434a58"},"before":{"candidateId":"3cf8faac1d89fb83d394db9d73c46a6d02597c6b22ca2f9e3626819155599b87","checkedAt":"2026-11-01T04:47:32.434Z","checks":[{"name":"rendering","result":"pass"},{"name":"navigation","result":"pass"},{"name":"links-assets","result":"pass"},{"name":"version-selection","result":"pass"},{"name":"search","result":"pass"},{"name":"schemas-examples","result":"pass"},{"name":"review","result":"pass"}],"phase":"candidate","projectionSha256":"152b6ea8514071e6c6e45da851df0c5b2b2de82bd58adac45653bccce6d9189f","publicationSha256":null,"rendererSha256":"3a1d841c758b2111519ff8ca9d2f040f3c671a9431a0e417f6733098f9434a58","result":"pass","snapshotsSha256":"386afca10c3575d755c1fce244aa22c8014e2b16f47410c7933a5fcb46ebaa3f","sourceRevision":"f4eb6b5530daa4030a2e439f689838c8367a42c8","sourceSha256":"3a1d841c758b2111519ff8ca9d2f040f3c671a9431a0e417f6733098f9434a58"}},"previousVersion":null,"product":"local-media-gallery","publication":{"assets":[{"bytes":"304661","id":697340724,"name":"full-prior.update.json","sha256":"5a410cb3079d664c676b8e404a529c85d4ccc94e0449a16f78535435f5f4e434","url":"https://github.com/shruggietech/local-media-gallery/releases/download/v0.1.0/full-prior.update.json"},{"bytes":"9420868","id":697344332,"name":"local-media-gallery-0.1.0-full-aarch64-macos-candidate.dmg","sha256":"407e5a4ce78a4d06fdae122d5576e06633e2b2c9767d17f862f27599d8eb7f98","url":"https://github.com/shruggietech/local-media-gallery/releases/download/v0.1.0/local-media-gallery-0.1.0-full-aarch64-macos-candidate.dmg"},{"bytes":"4976488","id":697344394,"name":"local-media-gallery-0.1.0-full-x86_64-linux-candidate.deb","sha256":"33b34b80ccfb30d68abb261b644196fc5455654804ebe5bda32999f0482a29e3","url":"https://github.com/shruggietech/local-media-gallery/releases/download/v0.1.0/local-media-gallery-0.1.0-full-x86_64-linux-candidate.deb"},{"bytes":"16963807","id":697344450,"name":"local-media-gallery-0.1.0-full-x86_64-windows-candidate.zip","sha256":"7878f6eeb587e43baac3183683bfd259273a55fe65c4bc3b1745a3f3b697779e","url":"https://github.com/shruggietech/local-media-gallery/releases/download/v0.1.0/local-media-gallery-0.1.0-full-x86_64-windows-candidate.zip"},{"bytes":"8671978","id":697344528,"name":"local-media-gallery-0.1.0-lite-aarch64-macos-candidate.zip","sha256":"404ec778ff58278a6dc54131b801f0408a78e5e838d6b1bff75496a6df380a39","url":"https://github.com/shruggietech/local-media-gallery/releases/download/v0.1.0/local-media-gallery-0.1.0-lite-aarch64-macos-candidate.zip"},{"bytes":"6842356","id":697344583,"name":"local-media-gallery-0.1.0-li